,SoW,title,Standards,introduction,scope,id
0,"The premise of the NGCI Apex program is to discover, develop, and transition new prototype technologies, designed to protect the overall critical infrastructure of the financial sector. _New technologies will be deployed to identify, protect, detect, respond, and recover, from a wide range of evolving cyber threats across five identified asset classes: devices, applications, networks, data, and people. _These technologies will be monitored to ensure they remain effective and relevant in the face of evolving threats. _The CART has developed a matrixed approach to help identify the areas of focus for the NGCI Apex program (see Figure 8 below).",Information technology — Security techniques — Information security risk management,https://www.iso.org/obp/ui/#!iso:std:56742:en,"IntroductionThis International Standard provides guidelines for information security risk management in an organization, supporting in particular the requirements of an information security management (ISMS) according to ISO/IEC 27001. However, this International Standard does not provide any specific method for information security risk management. It is up to the organization to define their approach to risk management, depending for example on the scope of the ISMS, context of risk management, or industry sector. A number of existing methodologies can be used under the framework described in this International Standard to implement the requirements of an ISMS.This International Standard is relevant to managers and staff concerned with information security risk management within an organization and, where appropriate, external parties supporting such activities.","1   ScopeThis International Standard provides guidelines for information security risk management.This International Standard supports the general concepts specified in ISO/IEC 27001 and is designed to assist the satisfactory implementation of information security based on a risk management approach.Knowledge of the concepts, models, processes and terminologies described in ISO/IEC 27001 and ISO/IEC 27002 is important for a complete understanding of this International Standard.This International Standard is applicable to all types of organizations (e.g. commercial enterprises, government agencies, non-profit organizations) which intend to manage risks that could compromise the organization’s information security.",ISO/IEC 27005:2011(en)
1,"The premise of the NGCI Apex program is to discover, develop, and transition new prototype technologies, designed to protect the overall critical infrastructure of the financial sector. _New technologies will be deployed to identify, protect, detect, respond, and recover, from a wide range of evolving cyber threats across five identified asset classes: devices, applications, networks, data, and people. _These technologies will be monitored to ensure they remain effective and relevant in the face of evolving threats. _The CART has developed a matrixed approach to help identify the areas of focus for the NGCI Apex program (see Figure 8 below).",Information technology — Service management — Part 1: Service management system requirements,https://www.iso.org/obp/ui/#!iso:std:51986:en,"IntroductionThe requirements in this part of ISO/IEC 20000 include the design, transition, delivery and improvement of services that fulfil service requirements and provide value for both the customer and the service provider. This part of ISO/IEC 20000 requires an integrated process approach when the service provider plans, establishes, implements, operates, monitors, reviews, maintains and improves a service management system (SMS).Co-ordinated integration and implementation of an SMS provides ongoing control and opportunities for continual improvement, greater effectiveness and efficiency. The operation of processes as specified in this part of ISO/IEC 20000 requires personnel to be well organized and co-ordinated. Appropriate tools can be used to enable the processes to be effective and efficient.The most effective service providers consider the impact on the SMS through all stages of the service lifecycle, from strategy through design, transition and operation, including continual improvement.This part of ISO/IEC 20000 requires the application of the methodology known as “Plan-Do-Check-Act” (PDCA) to all parts of the SMS and the services. The PDCA methodology, as applied in this part of ISO/IEC 20000, can be briefly described as follows.Plan: establishing, documenting and agreeing the SMS. The SMS includes the policies, objectives, plans and processes to fulfil the service requirements.Do: implementing and operating the SMS for the design, transition, delivery and improvement of the services.Check: monitoring, measuring and reviewing the SMS and the services against the policies, objectives, plans and service requirements and reporting the results.Act: taking actions to continually improve performance of the SMS and the services.When used within an SMS, the following are the most important aspects of an integrated process approach and the PDCA methodology:a) understanding and fulfilling the service requirements to achieve customer satisfaction;b) establishing the policy and objectives for service management;c) designing and delivering services based on the SMS that add value for the customer;d) monitoring, measuring and reviewing performance of the SMS and the services;e) continually improving the SMS and the services based on objective measurements.Figure 1 illustrates how the PDCA methodology can be applied to the SMS, including the service management processes specified in Clauses 5 to 9, and the services. Each element of the PDCA methodology is a vital part of a successful implementation of an SMS. The improvement process used in this part of ISO/IEC 20000 is based on the PDCA methodology.Figure 1
—
PDCA methodology applied to service managementThis part of ISO/IEC 20000 enables a service provider to integrate its SMS with other management systems in the service provider's organization. The adoption of an integrated process approach and the PDCA methodology enables the service provider to align or fully integrate multiple management system standards. For example, an SMS can be integrated with a quality management system based on ISO 9001 or an information security management system based on ISO/IEC 27001.ISO/IEC 20000 is intentionally independent of specific guidance. The service provider can use a combination of generally accepted guidance and its own experience.Users of an International Standard are responsible for its correct application. An International Standard does not purport to include all necessary statutory and regulatory requirements and contractual obligations of the service provider. Conformity to an International Standard does not of itself confer immunity from statutory and regulatory requirements.For the purposes of research on service management standards, users are encouraged to share their views on ISO/IEC 20000-1 and their priorities for changes to the rest of the ISO/IEC 20000 series. Click on the link below to take part in the online survey.ISO/IEC 20000-1 online survey","1   Scope1.1   GeneralThis part of ISO/IEC 20000 is a service management system (SMS) standard. It specifies requirements for the service provider to plan, establish, implement, operate, monitor, review, maintain and improve an SMS. The requirements include the design, transition, delivery and improvement of services to fulfil service requirements. This part of ISO/IEC 20000 can be used by:a) an organization seeking services from service providers and requiring assurance that their service requirements will be fulfilled;b) an organization that requires a consistent approach by all its service providers, including those in a supply chain;c) a service provider that intends to demonstrate its capability for the design, transition, delivery and improvement of services that fulfil service requirements;d) a service provider to monitor, measure and review its service management processes and services;e) a service provider to improve the design, transition and delivery of services through effective implementation and operation of an SMS;f) an assessor or auditor as the criteria for a conformity assessment of a service provider's SMS to the requirements in this part of ISO/IEC 20000.Figure 2 illustrates an SMS, including the service management processes. The service management processes and the relationships between the processes can be implemented in different ways by different service providers. The nature of the relationship between a service provider and the customer will influence how the service management processes are implemented.Figure 2
—
Service management system1.2   ApplicationAll requirements in this part of ISO/IEC 20000 are generic and are intended to be applicable to all service providers, regardless of type, size and the nature of the services delivered. Exclusion of any of the requirements in Clauses 4 to 9 is not acceptable when a service provider claims conformity to this part of ISO/IEC 20000, irrespective of the nature of the service provider's organization.Conformity to the requirements in Clause 4 can only be demonstrated by a service provider showing evidence of fulfilling all of the requirements in Clause 4. A service provider cannot rely on evidence of the governance of processes operated by other parties for the requirements in Clause 4.Conformity to the requirements in Clauses 5 to 9 can be demonstrated by the service provider showing evidence of fulfilling all requirements. Alternatively, the service provider can show evidence of fulfilling the majority of the requirements themselves and evidence of the governance of processes operated by other parties for those processes, or parts of processes, that the service provider does not operate directly.The scope of this part of ISO/IEC 20000 excludes the specification for a product or tool. However, organizations can use this part of ISO/IEC 20000 to help them develop products or tools that support the operation of an SMS.NOTE ISO/IEC TR 20000-3 provides guidance on scope definition and applicability of this part of ISO/IEC 20000. This includes further explanation about the governance of processes operated by other parties.",ISO/IEC 20000-1:2011(en)
2,"The premise of the NGCI Apex program is to discover, develop, and transition new prototype technologies, designed to protect the overall critical infrastructure of the financial sector. _New technologies will be deployed to identify, protect, detect, respond, and recover, from a wide range of evolving cyber threats across five identified asset classes: devices, applications, networks, data, and people. _These technologies will be monitored to ensure they remain effective and relevant in the face of evolving threats. _The CART has developed a matrixed approach to help identify the areas of focus for the NGCI Apex program (see Figure 8 below).",Information technology — Security techniques — Information security controls for the energy utility industry,https://www.iso.org/obp/ui/#!iso:std:68091:en,"0	Introduction0.1	Background and contextThis document provides guiding principles based on ISO/IEC 27002:2013 “Code of practice for information security controls” for information security management applied to process control systems as used in the energy utility industry. The aim of this document is to extend the contents of ISO/IEC 27002:2013 to the domain of process control systems and automation technology, thus allowing the energy utility industry to implement a standardized and specific information security management system (ISMS) that is in accordance with ISO/IEC 27001:2013 and extends from the business to the process control level.In addition to the security objectives and measures that are set forth in ISO/IEC 27002:2013, the process control systems used by energy utilities and energy suppliers are subject to further special requirements. In comparison with conventional ICT environments (e.g. office IT, energy trading systems), there are fundamental and significant differences with respect to the development, operation, repair, maintenance and operating environment of process control systems. Furthermore, the process technology referred to in this document can represent integral components of critical infrastructures. This means they are therefore essential for the secure and reliable operation of such infrastructures. These distinctions and characteristics need to be taken into due consideration by the management processes for process control systems and justify separate consideration within the ISO/IEC 27000 family of standards.From the viewpoint of design and function, process control systems used by the energy utility sector are in fact information processing systems. They collect process data and monitor the status of the physical processes using sensors. The systems then process this data and generate control outputs that regulate actions using actuators. The control and regulation is automatic but manual intervention by operating personnel is also possible. Information and information processing systems are therefore an essential part of operational processes within energy utilities. This means that it is important that appropriate protection measures be applied in the same manner as for other organizational units.Software and hardware (e.g. programmable logic) components based on standard ICT technology are increasingly utilized in process control environments and are also covered in this document. Furthermore, process control systems in the energy utility sector are increasingly interconnected to form complex systems. Risks arising from this trend need to be considered in a risk assessment.The information and information processing systems in process control environments are also exposed to an increasing number of threats and vulnerabilities. It is therefore essential that, in the process control domain of the energy utility industry, adequate information security is achieved through the implementation and continuous improvement of an ISMS in accordance with ISO/IEC 27001:2013.Effective information security in the process control domain of the energy utility sector can be achieved by establishing, implementing, monitoring, reviewing and, if necessary, improving the applicable measures set forth in this document, in order to attain the specific security and business objectives of the organization. It is important to give particular consideration here to the special role of the energy utilities in society and to the economic necessity of a secure and reliable energy supply. Ultimately, the overall success of the cybersecurity of energy industries is based on collaborative efforts by all stakeholders (vendors, suppliers, customers, etc.).0.2	Security considerations for process control systems used by the energy utilitiesThe requirement for a general and overall information security framework for the process control domain of the energy utility industry is based on several basic requirements:a) Customers expect a secure and reliable energy supply.b) Legal and regulatory requirements demand safe, reliable and secure operation of energy supply systems.c) Energy providers require information security in order to safeguard their business interests, meet customers’ needs and comply with the legal regulations.0.3	Information security requirementsIt is essential that energy utility organizations identify their security requirements. There are three main sources of security requirements:a) The results of an organization’s risk assessment, taking into account the organization’s general business strategies and objectives. Through a risk assessment, risk sources and events are identified; potential consequences and likelihood of the occurrence of the risks are assessed.b) The requirements which result from legislation and bye-laws, regulations and contracts which have to be fulfilled by an organization, and sociocultural requirements. Particular examples include safeguarding a reliable, effective and secure energy supply as well as the reliable fulfilment of the requirements of a deregulated energy market, in particular the reliable and secure transfer of data with external parties.c) The specific principles, objectives and business requirements placed on information processing, which were developed by the organization for supporting its business operations.NOTE It is important that the energy utility organization ensure that security requirements of process control systems are analysed and adequately covered in policies for information security. The analysis of the information security requirements and objectives include the consideration of all relevant criteria for a secure energy supply and delivery, e.g.— Impairment of the security of energy supply;— Restriction of energy flow;— Affected share of population;— Danger of physical injury;— Effects on other critical infrastructures;— Effects on information privacy;— Financial impacts.The necessary security measures or controls are determined by the methodical assessment of security risks. It is necessary that the cost of controls be balanced against the economic losses that can be incurred due to security issues. The results of the risk assessment facilitate:— the definition of adequate management actions and priorities for the management of information security risks; and— the implementation of the controls chosen to protect against these risks.The risk assessment should be repeated periodically in order to take all changes into account, which can affect the results assessed.Requirements for the risk assessment and control selection are given in ISO/IEC 27001:2013.0.4	Selecting controlsOnce the security requirements and risks have been identified and decisions taken on how to deal with the risks, appropriate controls are then selected and implemented in order to ensure that the risks are reduced to an acceptable level.In addition to the controls provided by a comprehensive information security management system, this document provides additional assistance and sector-specific measures for the process control systems used by the energy utility sector, taking into consideration the special requirements in these environments. If necessary, further measures can be developed to fulfil particular requirements. The selection of security measures depends upon the decisions taken by the organization on the basis of its own risk acceptance criteria, the options for dealing with the risk and the general risk management approach of the organization. The selection of measures should also take relevant national and international law, legal ordinances and regulations into consideration.0.5	AudienceThis document is targeted at the persons responsible for the operation of process control systems used by energy utilities, information security managers, vendors, system integrators and auditors. For this target group, it details the fundamental measures in accordance with the objectives of ISO/IEC 27002:2013 and defines specific measures for process control systems of the energy utility industry, their supporting systems and the associated infrastructure.","1   ScopeThis document provides guidance based on ISO/IEC 27002:2013 applied to process control systems used by the energy utility industry for controlling and monitoring the production or generation, transmission, storage and distribution of electric power, gas, oil and heat, and for the control of associated supporting processes. This includes in particular the following:— central and distributed process control, monitoring and automation technology as well as information systems used for their operation, such as programming and parameterization devices;— digital controllers and automation components such as control and field devices or Programmable Logic Controllers (PLCs), including digital sensor and actuator elements;— all further supporting information systems used in the process control domain, e.g. for supplementary data visualization tasks and for controlling, monitoring, data archiving, historian logging, reporting and documentation purposes;— communication technology used in the process control domain, e.g. networks, telemetry, telecontrol applications and remote control technology;— Advanced Metering Infrastructure (AMI) components, e.g. smart meters;— measurement devices, e.g. for emission values;— digital protection and safety systems, e.g. protection relays, safety PLCs, emergency governor mechanisms;— energy management systems, e.g. of Distributed Energy Resources (DER), electric charging infrastructures, in private households, residential buildings or industrial customer installations;— distributed components of smart grid environments, e.g. in energy grids, in private households, residential buildings or industrial customer installations;— all software, firmware and applications installed on above-mentioned systems, e.g. DMS (Distribution Management System) applications or OMS (Outage Management System);— any premises housing the above-mentioned equipment and systems;— remote maintenance systems for above-mentioned systems.This document does not apply to the process control domain of nuclear facilities. This domain is covered by IEC 62645.This document also includes a requirement to adapt the risk assessment and treatment processes described in ISO/IEC 27001:2013 to the energy utility industry-sector–specific guidance provided in this document.",ISO/IEC 27019:2017(en)
3,"The premise of the NGCI Apex program is to discover, develop, and transition new prototype technologies, designed to protect the overall critical infrastructure of the financial sector. _New technologies will be deployed to identify, protect, detect, respond, and recover, from a wide range of evolving cyber threats across five identified asset classes: devices, applications, networks, data, and people. _These technologies will be monitored to ensure they remain effective and relevant in the face of evolving threats. _The CART has developed a matrixed approach to help identify the areas of focus for the NGCI Apex program (see Figure 8 below).",Information technology — Security techniques — Code of practice for information security controls based on ISO/IEC 27002 for cloud services,https://www.iso.org/obp/ui/#!iso:std:43757:en,"IntroductionThe guidelines contained within this Recommendation | International Standard are in addition to and complement the guidelines given in ISO/IEC 27002.Specifically, this Recommendation | International Standard provides guidelines supporting the implementation of information security controls for cloud service customers and cloud service providers. Some guidelines are for cloud service customers who implement the controls, and others are for cloud service providers to support the implementation of those controls. The selection of appropriate information security controls and the application of the implementation guidance provided, will depend on a risk assessment and any legal, contractual, regulatory or other cloud-sector specific information security requirements.",1   ScopeThis Recommendation | International Standard gives guidelines for information security controls applicable to the provision and use of cloud services by providing:– additional implementation guidance for relevant controls specified in ISO/IEC 27002;– additional controls with implementation guidance that specifically relate to cloud services.This Recommendation | International Standard provides controls and implementation guidance for both cloud service providers and cloud service customers.,ISO/IEC 27017:2015(en)
4,"The premise of the NGCI Apex program is to discover, develop, and transition new prototype technologies, designed to protect the overall critical infrastructure of the financial sector. _New technologies will be deployed to identify, protect, detect, respond, and recover, from a wide range of evolving cyber threats across five identified asset classes: devices, applications, networks, data, and people. _These technologies will be monitored to ensure they remain effective and relevant in the face of evolving threats. _The CART has developed a matrixed approach to help identify the areas of focus for the NGCI Apex program (see Figure 8 below).",Information technology — Security techniques — Code of practice for Information security controls based on ISO/IEC 27002 for telecommunications organizations,https://www.iso.org/obp/ui/#!iso:std:64143:en,,,ISO/IEC 27011:2016(en)
